company_name,website_link,address,phone_number,email_address,social_media_links,description
amrita trading,https://companyhouse.sg/amrita-trading,Not found,Not found,Not found,https://sg.linkedin.com/in/amreeta-eng-2a22a01b,Singapore company register & Basic information about the Business | Company House Singapore. Registration Name: AMRITA TRADING. Registration Number: 53394557K.
absolute costumez,https://absolutecostumez.com.sg/contact-us/?srsltid=AfmBOorb8TFLSb-vVc_eY7BmUdK_aVzl_XcRbebAFBdW3R9QPUnEH6pk,Not found,+65 6041 0635,absolutecostumez@gmail.com,"https://www.facebook.com/Absolutecostumez/, https://www.instagram.com/absolutecostumezsg/",Address. 62 Ubi Road 1 #01-17 Oxley Bizhub 2 Singapore 408734 ; Phone. +65 6041 0635 WhatsApp: +65 9663 5450 ; Email Us. absolutecostumez@gmail.com info@ ...
annie kids wholesale shop,https://companieshouse.sg/annie-kids-wholesale-shop-53488916J,Not found,+65 8962 4042,Not found,Not found,"Incorporated in Singapore on Jul 21, 2024, ANNIE KIDS WHOLESALE SHOP (UEN: 53488916J) is a sole-proprietor engaged in general business ..."
arkk trading limited liability partnership,https://techtalent.sg/company/arkk-trading-limited-liability-partnership-1c390ae835,Not found,+65 69585050,Not found,Not found,Contact Details. 4010 Ang Mo Kio Ave 10 #04-07. Social Profiles. About SGTech. SGTech is a premier trade association for the tech industry in Singapore. Within ...
baby shoppaholics,https://recordowl.com/company/baby-shoppaholics,Not found,+65 8754 7442,babyshoppaholics@gmail.com,"https://www.facebook.com/babyshoppaholics/, https://www.instagram.com/babys_shoppaholics/?hl=en, https://www.facebook.com/BabyShoppaholicsEst2013/",Only order if you can wait mommies! Thank you for your interest! SHARE AROUND! Join our TELEGRAM GROUP to browse ⬇⬇ https://t.me/+N4dW8Wf5Fg03ODU9 ...
bundles of joy sg,https://www.fredakhooclinic.com/bundles-of-joy/,Not found,8122 2029,info@fredakhooclinic.com,"https://www.facebook.com/bojsingapore/, https://sg.linkedin.com/in/bee-lee-ang-8620071a2",bundlesofjoy.com.sg. 󱛾. Pinned post. Bundles Of Joy Singapore profile picture ... WhatsApp them now @8122 2029 for a quotation and quote #BOJ50 for a $50 discount ...
bh fashion llp,https://www.companies.sg/business/T18LL1884D/BH-FASHION-LLP,Not found,Not found,Not found,https://www.facebook.com/p/BH-Fashion-100060894398077/,"The address of the Business's registered office is 2 KALLANG PUDDING ROAD, #06-13, MACTECH BUILDING, Singapore 349307. The Business current operating status is ..."
carrots and peas,https://recordowl.com/company/carrots-and-peas-pte-ltd,Not found,+65 8128 9326,hello@carrotsticksandcravings.com,"https://www.facebook.com/photo.php?fbid=5454876121193998&id=378167172198277&set=a.378177495530578, https://www.instagram.com/p/DCTs4MIyL3O/","Find key decision-makers, contacts, emails, headcount, share capital, recent funding, IPO status and other insights of CARROTS AND PEAS PTE. LTD."
crayonsky,https://www.sgpbusiness.com/company/Crayonsky-Pte-Ltd,Not found,+65 6950 7678,info.sg@crayon.com,Not found,Contact Information. Registered Address 842E TAMPINES STREET 82 #03-120. TAMPINES ARCADIA SINGAPORE (525842) View on Google Maps • 1 other ...
cheeky roos,https://recordowl.com/company/cheeky-roos-pte-ltd,Not found,Not found,Not found,"https://www.facebook.com/cheekyrooskids/?locale=sq_AL, https://www.instagram.com/cheekyrooskids/","The company's address is 31 SELETAR TERRACE, Singapore 806932. It was incorporated on June 9, 2023. Company Information. CHEEKY ROOS PTE. LTD. (the ""Company"") ..."
